{
  "$schema": "https://json-schema.org/draft/2019-09/schema#",
  "$id": "https://www.powsybl.orgopen-rao-crac-schema=crac-v1.1.schema",
  "title": "CRAC",
  "description": "CRAC data for electric grid operation",
  "type": "object",
  "properties": {
    "type": {
      "const": "CRAC"
    },
    "version": {
      "const": "1.1"
    },
    "info": {
      "type": "string"
    },
    "id": {
      "type": "string"
    },
    "name": {
      "type": "string"
    },
    "networkElementsNamePerId": {
      "type": "object",
      "additionalProperties": {
        "type": "string"
      }
    },
    "contingencies": {
      "$ref": "resource:/schemas/common/contingency.json"
    },
    "flowCnecs": {
      "type": "array",
      "items": {
        "items": {
          "$ref": "resource:/schemas/flow-cnec/flow-cnec-v1.0.json"
        }
      }
    },
    "pstRangeActions": {
      "type": "array",
      "items": {
        "$ref": "resource:/schemas/pst-range-action/pst-range-action-v1.0.json"
      }
    },
    "hvdcRangeActions": {
      "type": "array",
      "items": {
        "$ref": "resource:/schemas/hvdc-range-action/hvdc-range-action-v1.0.json"
      }
    },
    "networkActions": {
      "type": "array",
      "items": {
        "$ref": "resource:/schemas/network-action/network-action-v1.1.json"
      }
    }
  },
  "additionalProperties": false,
  "required": [
    "type",
    "version",
    "id",
    "name",
    "contingencies",
    "flowCnecs",
    "pstRangeActions",
    "hvdcRangeActions",
    "networkActions"
  ]
}
