{
  "type" : "CRAC",
  "version" : "1.1",
  "info" : "Generated by FARAO http://farao-community.github.io",
  "id" : "20161215_0430_2D4_CRAC_FR",
  "name" : "20161215_0430_2D4_CRAC_FR",
  "networkElementsNamePerId" : { },
  "contingencies" : [ ],
  "flowCnecs" : [ {
    "id" : "be1_be2_n - BBE1AA11->BBE2AA11 - preventive",
    "name" : "be1_be2_n",
    "networkElementId" : "BBE1AA11 BBE2AA11 1",
    "operator" : null,
    "instant" : "preventive",
    "optimized" : true,
    "monitored" : false,
    "frm" : 0.0,
    "iMax" : [ 2000.0 ],
    "nominalV" : [ 400.0 ],
    "thresholds" : [ {
      "unit" : "ampere",
      "min" : -2000.0,
      "max" : 2000.0,
      "rule" : "onLeftSide"
    } ]
  }, {
    "id" : "be1_fr5_n - BBE1AA11->FFR5AA11 - preventive",
    "name" : "be1_fr5_n",
    "networkElementId" : "BBE1AA11 FFR5AA11 1",
    "operator" : null,
    "instant" : "preventive",
    "optimized" : true,
    "monitored" : false,
    "frm" : 0.0,
    "iMax" : [ 2000.0 ],
    "nominalV" : [ 400.0 ],
    "thresholds" : [ {
      "unit" : "ampere",
      "min" : -2000.0,
      "max" : 2000.0,
      "rule" : "onLeftSide"
    } ]
  }, {
    "id" : "nl1_nl2_n - NNL1AA11->NNL2AA11 - preventive",
    "name" : "nl1_nl2_n",
    "networkElementId" : "NNL1AA11 NNL2AA11 1",
    "operator" : null,
    "instant" : "preventive",
    "optimized" : true,
    "monitored" : false,
    "frm" : 0.0,
    "iMax" : [ 2000.0 ],
    "nominalV" : [ 400.0 ],
    "thresholds" : [ {
      "unit" : "megawatt",
      "min" : -100.0,
      "max" : 100.0,
      "rule" : "onLeftSide"
    } ]
  }, {
    "id" : "be2_be5_n - BBE2AA11->BBE5AA11 - preventive",
    "name" : "be2_be5_n",
    "networkElementId" : "BBE2AA11 BBE5AA11 1",
    "operator" : null,
    "instant" : "preventive",
    "optimized" : true,
    "monitored" : false,
    "frm" : 0.0,
    "iMax" : [ 2000.0 ],
    "nominalV" : [ 400.0 ],
    "thresholds" : [ {
      "unit" : "megawatt",
      "min" : -10000.0,
      "max" : 10000.0,
      "rule" : "onLeftSide"
    } ]
  } ],
  "pstRangeActions" : [ ],
  "hvdcRangeActions" : [ {
    "id" : "PRA_HVDC",
    "name" : "PRA_HVDC",
    "operator" : "FR",
    "freeToUseUsageRules" : [ {
      "instant" : "preventive",
      "usageMethod" : "available"
    } ],
    "networkElementId" : "BBE5AA11 FFR3AA11 1",
    "ranges" : [ {
      "min" : -100.0,
      "max" : 100.0
    } ]
  } ],
  "networkActions" : [ ]
}