{
  "type" : "CRAC",
  "version" : "1.1",
  "info" : "Generated by FARAO http://farao-community.github.io",
  "id" : "20161215_0430_2D4_CRAC_FR",
  "name" : "20161215_0430_2D4_CRAC_FR",
  "networkElementsNamePerId" : { },
  "contingencies" : [ ],
  "flowCnecs" : [ {
    "id" : "de2_de3_n - DDE2AA11->DDE3AA11 - preventive",
    "name" : "de2_de3_n",
    "networkElementId" : "DDE2AA11 DDE3AA11 1",
    "operator" : null,
    "instant" : "preventive",
    "optimized" : true,
    "monitored" : false,
    "frm" : 0.0,
    "iMax" : [ 2000.0 ],
    "nominalV" : [ 400.0 ],
    "thresholds" : [ {
      "unit" : "ampere",
      "min" : -72.0,
      "max" : 72.0,
      "rule" : "onLeftSide"
    } ]
  } ],
  "pstRangeActions" : [ ],
  "hvdcRangeActions" : [ {
    "id" : "PRA_HVDC",
    "name" : "PRA_HVDC",
    "operator" : "FR",
    "freeToUseUsageRules" : [ {
      "instant" : "preventive",
      "usageMethod" : "available"
    } ],
    "networkElementId" : "BBE2AA11 FFR3AA11 1",
    "ranges" : [ {
      "min" : -2000.0,
      "max" : 2000.0
    } ]
  } ],
  "networkActions" : [ ]
}